<?xml version="1.0" encoding="UTF-8"?>
<vegetables xmlns:xsi="http://www.w3.org/2001/XMLSchema-instance" xsi:noNamespaceSchemaLocation="initVeget.xsd">
    <vegetable name="cabbage">
        <uid>d00000001</uid>
        <country>usa</country>
        <data>
            <year>2011</year>
            <month>--10--</month>
            <day>---11</day>
        </data>
        <weight-per-kg>0.5</weight-per-kg>
        <price-per-kg>201</price-per-kg>
        <quality-of-veget>Good</quality-of-veget>
        <uniq-parameter>1</uniq-parameter>
    </vegetable>
    <vegetable name="dill">
        <uid>d00000002</uid>
        <country>usa</country>
        <data>
            <year>2011</year>
            <month>--09--</month>
            <day>---11</day>
        </data>
        <weight-per-kg>0.6</weight-per-kg>
        <price-per-kg>202</price-per-kg>
        <quality-of-veget>Eatable</quality-of-veget>
        <uniq-parameter>str2</uniq-parameter>
    </vegetable>
    <vegetable name="mint">
        <uid>d00000003</uid>
        <country>usa</country>
        <data>
            <year>2011</year>
            <month>--08--</month>
            <day>---11</day>
        </data>
        <weight-per-kg>0.7</weight-per-kg>
        <price-per-kg>203</price-per-kg>
        <quality-of-veget>Good</quality-of-veget>
        <uniq-parameter>str3</uniq-parameter>
    </vegetable>
    <vegetable name="tomato">
        <uid>d00000004</uid>
        <country>usa</country>
        <data>
            <year>2011</year>
            <month>--07--</month>
            <day>---11</day>
        </data>
        <weight-per-kg>0.8</weight-per-kg>
        <price-per-kg>204</price-per-kg>
        <quality-of-veget>Good</quality-of-veget>
        <uniq-parameter>str4</uniq-parameter>
    </vegetable>
    <vegetable name="cucumber">
        <uid>d00000005</uid>
        <country>usa</country>
        <data>
            <year>2011</year>
            <month>--06--</month>
            <day>---11</day>
        </data>
        <weight-per-kg>0.9</weight-per-kg>
        <price-per-kg>205</price-per-kg>
        <quality-of-veget>Good</quality-of-veget>
        <uniq-parameter>str5</uniq-parameter>
    </vegetable>
    <vegetable name="potatoes">
        <uid>d00000006</uid>
        <country>usa</country>
        <data>
            <year>2011</year>
            <month>--06--</month>
            <day>---11</day>
        </data>
        <weight-per-kg>1.0</weight-per-kg>
        <price-per-kg>206</price-per-kg>
        <quality-of-veget>Good</quality-of-veget>
        <uniq-parameter>6</uniq-parameter>
    </vegetable>
    <vegetable name="cabbage">
        <uid>d00000007</uid>
        <country>usa</country>
        <data>
            <year>2011</year>
            <month>--10--</month>
            <day>---11</day>
        </data>
        <weight-per-kg>0.5</weight-per-kg>
        <price-per-kg>201</price-per-kg>
        <quality-of-veget>Good</quality-of-veget>
        <uniq-parameter>1</uniq-parameter>
    </vegetable>
    <vegetable name="dill">
        <uid>d00000008</uid>
        <country>usa</country>
        <data>
            <year>2011</year>
            <month>--09--</month>
            <day>---11</day>
        </data>
        <weight-per-kg>0.6</weight-per-kg>
        <price-per-kg>202</price-per-kg>
        <quality-of-veget>Eatable</quality-of-veget>
        <uniq-parameter>str2</uniq-parameter>
    </vegetable>
    <vegetable name="mint">
        <uid>d00000009</uid>
        <country>usa</country>
        <data>
            <year>2011</year>
            <month>--08--</month>
            <day>---11</day>
        </data>
        <weight-per-kg>0.7</weight-per-kg>
        <price-per-kg>203</price-per-kg>
        <quality-of-veget>Good</quality-of-veget>
        <uniq-parameter>str3</uniq-parameter>
    </vegetable>
    <vegetable name="tomato">
        <uid>d00000010</uid>
        <country>usa</country>
        <data>
            <year>2011</year>
            <month>--07--</month>
            <day>---11</day>
        </data>
        <weight-per-kg>0.8</weight-per-kg>
        <price-per-kg>204</price-per-kg>
        <quality-of-veget>Good</quality-of-veget>
        <uniq-parameter>str4</uniq-parameter>
    </vegetable>
    <vegetable name="cucumber">
        <uid>d00000011</uid>
        <country>usa</country>
        <data>
            <year>2011</year>
            <month>--06--</month>
            <day>---11</day>
        </data>
        <weight-per-kg>0.9</weight-per-kg>
        <price-per-kg>205</price-per-kg>
        <quality-of-veget>Eatable</quality-of-veget>
        <uniq-parameter>str5</uniq-parameter>
    </vegetable>
    <vegetable name="potatoes">
        <uid>d00000012</uid>
        <country>usa</country>
        <data>
            <year>2011</year>
            <month>--06--</month>
            <day>---11</day>
        </data>
        <weight-per-kg>1.0</weight-per-kg>
        <price-per-kg>206</price-per-kg>
        <quality-of-veget>Good</quality-of-veget>
        <uniq-parameter>6</uniq-parameter>
    </vegetable>
</vegetables>